{
  "$schema": "../../brand-system-spec/v1/schemas/tokens.schema.json",
  "schemaVersion": "1.0.0",
  "color": {
    "brand": {
      "heritageDeep": { "value": "#06312B", "type": "color", "confidence": "verified", "sourceIds": ["source.audit.home.desktop"] },
      "heritage": { "value": "#3B5F58", "type": "color", "confidence": "verified", "sourceIds": ["source.audit.product.desktop", "source.audit.design-services.desktop"] },
      "heritageBright": { "value": "#1E5F53", "type": "color", "confidence": "verified", "sourceIds": ["source.audit.collection.desktop"] },
      "powder": { "value": "#C6D0DC", "type": "color", "confidence": "verified", "sourceIds": ["source.audit.collection.desktop"] },
      "sale": { "value": "#CA3B4C", "type": "color", "confidence": "verified", "sourceIds": ["source.audit.collection.desktop"] }
    },
    "text": {
      "primary": { "value": "#000000", "type": "color", "confidence": "verified" },
      "editorial": { "value": "#323232", "type": "color", "confidence": "verified" },
      "secondary": { "value": "#555555", "type": "color", "confidence": "inferred" },
      "muted": { "value": "#777777", "type": "color", "confidence": "inferred" },
      "inverse": { "value": "#FFFFFF", "type": "color", "confidence": "verified" }
    },
    "surface": {
      "base": { "value": "#FFFFFF", "type": "color", "confidence": "verified" },
      "warm": { "value": "#FAF9F7", "type": "color", "confidence": "inferred" },
      "muted": { "value": "#F5F5F5", "type": "color", "confidence": "verified" },
      "cool": { "value": "#F5F7F7", "type": "color", "confidence": "verified" }
    },
    "border": {
      "subtle": { "value": "#E5E7EB", "type": "color", "confidence": "verified" },
      "strong": { "value": "#999999", "type": "color", "confidence": "verified" }
    }
  },
  "typography": {
    "families": {
      "editorial": { "value": "Chronicle Display", "fallback": "Georgia, 'Times New Roman', serif", "confidence": "verified" },
      "interface": { "value": "Sofia Pro", "fallback": "Avenir, Montserrat, Arial, sans-serif", "confidence": "verified" },
      "reading": { "value": "Lato", "fallback": "Arial, sans-serif", "confidence": "verified" }
    },
    "roles": {
      "display": { "family": "editorial", "size": { "desktop": 48, "tablet": 40, "mobile": 34 }, "lineHeight": 1.08, "weight": 400, "letterSpacingEm": 0, "case": "sentence" },
      "editorialHeading": { "family": "editorial", "size": { "desktop": 30, "mobile": 26 }, "lineHeight": 1.15, "weight": 400, "letterSpacingEm": 0, "case": "sentence" },
      "sectionHeading": { "family": "interface", "size": { "desktop": 30, "mobile": 25 }, "lineHeight": 1.2, "weight": 400, "letterSpacingEm": 0.1, "case": "uppercase" },
      "productTitle": { "family": "interface", "size": { "desktop": 20, "mobile": 18 }, "lineHeight": 1.3, "weight": 800, "letterSpacingEm": 0, "case": "title" },
      "subheading": { "family": "interface", "size": { "desktop": 20, "mobile": 18 }, "lineHeight": 1.3, "weight": 600, "letterSpacingEm": 0, "case": "title" },
      "body": { "family": "reading", "size": { "desktop": 16, "mobile": 16 }, "lineHeight": 1.55, "weight": 400, "letterSpacingEm": 0.025, "case": "sentence" },
      "bodySmall": { "family": "reading", "size": { "desktop": 14, "mobile": 14 }, "lineHeight": 1.5, "weight": 400, "letterSpacingEm": 0.02, "case": "sentence" },
      "navigation": { "family": "interface", "size": { "desktop": 14, "mobile": 14 }, "lineHeight": 1.2, "weight": 500, "letterSpacingEm": 0.02, "case": "title" },
      "action": { "family": "interface", "size": { "desktop": 12, "mobile": 12 }, "lineHeight": 1.15, "weight": 800, "letterSpacingEm": 0.145, "case": "uppercase" },
      "label": { "family": "interface", "size": { "desktop": 12, "mobile": 12 }, "lineHeight": 1.2, "weight": 800, "letterSpacingEm": 0.08, "case": "uppercase" }
    },
    "licensing": "Chronicle Display, Sofia Pro, and Lato were observed on the live site. Consumers must supply legally licensed font files or use the documented fallbacks."
  },
  "space": {
    "2xs": { "value": 4, "unit": "px" },
    "xs": { "value": 8, "unit": "px" },
    "sm": { "value": 12, "unit": "px" },
    "md": { "value": 16, "unit": "px" },
    "lg": { "value": 24, "unit": "px" },
    "xl": { "value": 32, "unit": "px" },
    "2xl": { "value": 48, "unit": "px" },
    "3xl": { "value": 64, "unit": "px" },
    "4xl": { "value": 80, "unit": "px" },
    "5xl": { "value": 96, "unit": "px" }
  },
  "size": {
    "control": { "compact": 40, "default": 48, "prominent": 52 },
    "icon": { "small": 16, "default": 20, "large": 24 },
    "touchTargetMinimum": 44
  },
  "shape": {
    "radius": {
      "none": { "value": 0, "unit": "px", "usage": "default controls, cards, panels, and media" },
      "subtle": { "value": 2, "unit": "px", "usage": "small status chips only" },
      "circle": { "value": 9999, "unit": "px", "usage": "icon controls and avatars only" }
    }
  },
  "border": {
    "hairline": { "width": 1, "style": "solid" },
    "control": { "width": 2, "style": "solid" }
  },
  "layout": {
    "contentMax": { "value": 1280, "unit": "px", "confidence": "inferred" },
    "pageMax": { "value": 1440, "unit": "px", "confidence": "inferred" },
    "gutter": { "desktop": 32, "tablet": 24, "mobile": 16 },
    "columns": { "desktop": 12, "tablet": 8, "mobile": 4 },
    "breakpoints": { "compact": 0, "medium": 768, "wide": 1024, "expanded": 1280 },
    "imageRatios": {
      "editorialWide": "2:1",
      "campaignWide": "144:73",
      "productSquare": "1:1",
      "categoryPortrait": "0.81:1"
    }
  }
}
